lead_id,customer_summary,agent_summary,conversion_label
1,"Inquired about the cost of a routine dental cleaning, mentioned the $150 price was a bit steep at the moment.",Provided detailed information on the cleaning service and its cost; the customer expressed some concerns about the price and decided not to book an appointment at this time.,0
2,"Asked for the complete pricing on dental implants and became unresponsive after learning the total cost would be around $3,000.","Thoroughly explained the dental implant procedure, including the benefits and all associated costs, but the customer ceased communication after the price was mentioned.",0
3,Was curious about the price of a root canal treatment and stated they needed some time to think it over after hearing the quote.,"Gave a comprehensive breakdown of the root canal costs, and the customer indicated they needed to consider their options before proceeding with scheduling.",0
4,Called to ask about the typical cost for wisdom tooth extraction and then abruptly ended the call after being quoted the price.,"Provided a clear estimate for the cost of a wisdom tooth extraction, but the customer disconnected the call shortly after receiving the pricing information.",0
5,"Requested the price for a professional teeth whitening session and promised to call back to schedule, but has not done so yet.",Shared the current pricing for our teeth whitening treatments; the customer stated they would follow up but has not yet contacted us again to book.,0
6,"Asked about the full cost of braces for their teenage son and seemed quite taken aback by the $4,000 price point.","Explained the comprehensive nature of our orthodontic treatments and the associated costs, but the customer appeared to be concerned about the overall expense.",0
7,Inquired about the pricing for a dental bridge and mentioned that they would need to save up some money before they could proceed.,"Provided a detailed cost analysis for a dental bridge, and the customer communicated that there were some financial constraints they needed to address first.",0
8,Asked about the cost of a cavity filling and ultimately decided it would be best to wait until the following month to get it done.,"Gave the customer all the details on the price of a filling, but they made the decision to postpone the dental treatment for a short while.",0
9,Called to get information on denture pricing and said they were planning to shop around to see if they could find any better deals.,"Shared our complete pricing for new dentures, but the customer expressed a desire to compare our prices with other dental providers in the area.",0
10,"Asked about the total cost for a dental crown and then went completely silent on the line after hearing the $1,200 price.","Clearly explained the entire crown procedure from start to finish and provided the pricing, but the customer did not offer any further response.",0
11,Was experiencing severe and persistent tooth pain and was eager to book an emergency appointment for the very same day.,Recognized the urgency of the dental emergency and was able to prioritize their situation and schedule an immediate treatment for later in the day.,1
12,Asked about our current appointment availability for a routine dental cleaning and went ahead and booked a slot for next Tuesday morning.,Offered the customer a few different available time slots for a cleaning and successfully confirmed their new appointment for Tuesday at 10 AM.,1
13,Called us in a panic about a badly broken tooth and was able to schedule an emergency dental repair for later today.,"Quickly arranged for an urgent dental repair appointment for the customer, ensuring they would be seen within the next couple of hours.",1
14,Requested a formal consultation to discuss the possibility of getting a dental implant and confirmed an appointment for this coming Friday.,Scheduled a comprehensive implant consultation and a thorough examination to assess their suitability for the procedure later in the week.,1
15,Asked about the cost of a standard teeth cleaning and then said they would need to wait for their insurance company's approval before booking.,"Provided the customer with our standard pricing for a cleaning, but they informed us that they needed to get verification from their insurance provider first.",0
16,"Inquired about the pricing for a set of porcelain veneers and seemed quite hesitant to commit after hearing the $8,000 total cost.","Explained the full veneer application process and the long-term benefits, as well as the costs, but the customer appeared to be very sensitive to the price.",0
17,Asked about the cost of a full orthodontic treatment plan and mentioned that they really needed to discuss it with their spouse first.,"Shared our current pricing and package options for braces, but the customer indicated that a family discussion was necessary before making a final decision.",0
18,Called our line about a pressing dental emergency but then balked at having to pay the $300 emergency examination fee upfront.,"Clearly explained all the costs associated with an emergency dental treatment, but the customer ultimately declined the appointment due to the price of the fee.",0
19,"Requested a detailed quote for a full mouth restoration and then went completely silent after receiving the $15,000 estimated cost.","Provided a very comprehensive and detailed treatment plan with all the associated costs, but the customer did not respond to any of our follow-up messages.",0
20,Asked about the price of our in-office teeth whitening treatment and then stated they would probably look for some cheaper options online.,"Gave the customer all the details on our professional whitening services and the costs, but they expressed an interest in finding lower-priced alternatives.",0
21,"Inquired about the total cost for a periodontal treatment plan and said they simply could not afford the $2,000 price tag at this moment.","Explained the importance of the gum disease treatment and the pricing, but the customer clearly indicated that they had some significant budget constraints at present.",0
22,Inquired about the price of a routine dental cleaning and then made the decision to wait until they received their next paycheck to book.,"Provided the current costs for a routine dental cleaning, but the customer let us know that they would need to wait for their next payday to have the funds.",0
23,Called our office asking about the cost of a tooth extraction and seemed genuinely surprised when they were quoted the $400 fee.,"Gave the customer our standard pricing for a tooth extraction, but their reaction suggested they were quite shocked by the expected amount for the procedure.",0
24,Asked about the cost of a new patient dental checkup and then said they would probably just end up using their old dentist instead.,"Shared our current examination fees for new patients, but the customer ultimately chose to seek dental care from their previous provider.",0
25,Requested a complete quote for some extensive dental work and then became unresponsive after hearing the total estimated cost for the procedures.,"Provided a thorough and comprehensive breakdown of the treatment costs, but we were unable to get any further response from the customer.",0
26,"Was dealing with a painful dental emergency with severe, throbbing pain and was relieved to be able to book an immediate appointment with us.","Made arrangements for an urgent, same-day dental treatment to address the customer's painful and distressing dental emergency.",1
27,Called our office to inquire about a routine cleaning appointment and was happy to schedule one for early on in the next week.,"Successfully confirmed a regular dental cleaning appointment for the customer for the upcoming Tuesday, as per their request.",1
28,Asked about scheduling an appointment for their child's first dental checkup and was pleased to be able to book a Saturday morning slot.,Scheduled a pediatric dental examination for the customer's child over the weekend to accommodate their family's schedule.,1
29,Requested immediate emergency dental care for a serious issue and was able to come into the office for treatment within the hour.,Provided prompt and immediate emergency dental treatment to the patient upon their arrival at our clinic.,1
30,Called us about a broken filling that was causing some discomfort and was able to schedule a repair appointment for later today.,Arranged for a convenient same-day appointment to repair the customer's broken filling and alleviate their discomfort.,1
31,Inquired about the price of a deep cleaning for periodontal disease and said the $800 cost was more than they could handle right now.,"Explained the necessity of the deep cleaning procedure and provided the cost, but the customer stated that it was currently beyond their financial means.",0
32,Asked about the cost of sedation dentistry for an upcoming procedure and decided to opt out after hearing about the additional fees involved.,"Provided a clear explanation of the costs associated with sedation dentistry, and the customer chose not to proceed with that option due to the expense.",0
33,"Called to get a price check on a single dental veneer and seemed disappointed that it would cost $1,200 for just one tooth.","Informed the customer about the price for a single veneer, and their reaction indicated that they were hoping for a lower cost for the cosmetic treatment.",0
34,Requested a quote for a complete set of upper and lower dentures and stated they needed to check their retirement savings before committing.,"Provided a detailed quote for the full set of dentures, and the customer mentioned that they needed to review their personal finances before making a decision.",0
35,Asked about the cost of an emergency tooth extraction and then said they would just take painkillers and hope it gets better on its own.,"Communicated the price for an emergency extraction, but the customer decided to forego professional treatment and manage the pain themselves for the time being.",0
36,Was in a great deal of pain from a suspected tooth abscess and was very grateful to be scheduled for an emergency root canal the same day.,Identified the signs of a serious tooth abscess and immediately scheduled the patient for an emergency root canal to address the infection and pain.,1
37,Called to schedule a follow-up appointment after their recent dental surgery and booked the earliest available time slot with the dentist.,"Assisted the patient in scheduling their post-operative follow-up appointment, confirming a time that was both convenient and clinically appropriate.",1
38,Asked to book a routine dental check-up and cleaning for both themselves and their spouse and found a time that worked for both of them.,Successfully scheduled back-to-back appointments for the customer and their spouse for their regular dental check-ups and cleanings.,1
39,"Had a crown fall off and was anxious to get it re-cemented as soon as possible, so they booked an appointment for the next morning.",Addressed the customer's concern about their lost crown and scheduled a priority appointment to have it re-cemented at their earliest convenience.,1
40,Called to make an appointment for their daughter's orthodontic consultation and scheduled it for after school on the following Wednesday.,"Arranged for a convenient after-school time slot for the daughter's initial orthodontic consultation, as requested by the parent.",1
41,Inquired about the price of a dental bonding procedure to fix a small chip and said they would have to think about it after hearing the $400 cost.,"Provided the price for the dental bonding, and the customer expressed that they needed some time to consider the expense before moving forward.",0
42,Asked for the cost of a night guard to prevent teeth grinding and seemed hesitant to spend $500 on the custom-made device.,"Explained the benefits and cost of a custom-fitted night guard, but the customer appeared to be unsure about the value of the investment.",0
43,"Called to get a price for replacing an old, discolored filling and decided to wait until their insurance plan reset for the new year.","Gave the customer the price for replacing the filling, and they indicated a preference to wait for their new insurance benefits to become active.",0
44,Requested a quote for a full 'smile makeover' involving multiple cosmetic procedures and went silent after the multi-thousand dollar estimate.,"Provided a comprehensive and detailed quote for the full smile makeover, but the potential customer did not respond to any further communications.",0
45,"Asked about the cost of an x-ray and dental exam and said they would call back, but they never did.","Informed the customer of the cost for the examination and x-rays, and while they said they would call back, no further contact was made.",0
46,Was experiencing significant bleeding from their gums and was concerned enough to book an immediate consultation with the periodontist.,Recognized the potential seriousness of the bleeding gums and scheduled an urgent consultation with the periodontist for a thorough evaluation.,1
47,Called to schedule a new patient appointment for a general check-up and was happy to take the first available opening in the calendar.,Welcomed the new patient and successfully scheduled their initial comprehensive examination for the very next available appointment slot.,1
48,"Had a temporary crown break and needed to get it fixed right away, so they booked an emergency appointment for the same afternoon.",Understood the urgency of the broken temporary crown and was able to fit the patient in for a repair appointment later that same day.,1
49,Asked to book their child's six-month cleaning and check-up and scheduled it for their upcoming school holiday.,"Helped the parent schedule their child's routine dental appointment, finding a convenient time during the school break.",1
50,Called to get a referral to an oral surgeon for a complex extraction and booked the consultation that was recommended.,Provided the patient with a referral to a trusted oral surgeon and assisted them in scheduling the necessary consultation appointment.,1
51,Inquired about the cost of professional teeth whitening strips available at the clinic and decided to stick with store-bought ones for now.,"Provided information and pricing on the professional-grade whitening strips, but the customer opted for a more budget-friendly retail option instead.",0
52,"Asked for a price estimate on a gum graft surgery and expressed that the $2,500 cost was a major financial hurdle for them at this time.","Explained the details of the gum graft procedure and the associated costs, and the customer shared that the expense was a significant barrier to treatment.",0
53,Called to get a quote for replacing all of their old metal fillings with new composite ones and seemed overwhelmed by the total estimated cost.,"Provided a comprehensive quote for the replacement of all amalgam fillings, but the customer appeared to be taken aback by the overall financial commitment.",0
54,Requested the price of an athletic mouthguard for their child who plays sports and decided to look for a cheaper boil-and-bite option online.,"Shared the pricing for a custom-fitted athletic mouthguard, but the parent indicated a preference for a less expensive, non-custom alternative.",0
55,Asked about the cost of a consultation for TMJ (jaw pain) and said they needed to see if their medical insurance would cover any of it first.,Informed the customer about the cost of a TMJ consultation and they stated that they needed to investigate their insurance coverage before scheduling.,0
56,Had a severe toothache that had kept them up all night and was desperate to be seen by a dentist as soon as the office opened.,Responded to the customer's urgent plea for help with their severe toothache and scheduled them for the very first appointment of the day.,1
57,Called to book a dental cleaning and exam for their elderly parent who had just moved into the area and needed a new dentist.,"Assisted the caller in scheduling a comprehensive new patient appointment for their elderly parent, ensuring a comfortable and accessible time slot.",1
58,"Had a wire from their braces break and was causing irritation to their cheek, so they booked an emergency orthodontic appointment right away.",Understood the discomfort being caused by the broken braces and immediately scheduled an emergency appointment for an orthodontic repair.,1
59,Asked to schedule a follow-up appointment to monitor a suspicious-looking spot that the dentist had noted during their last visit.,Prioritized the patient's request for a follow-up and scheduled a monitoring appointment to re-evaluate the area of concern with the dentist.,1
60,"Called to make an appointment for a new set of dentures, as their old ones were no longer fitting properly and causing sores.","Recognized the discomfort and functional issues with the ill-fitting dentures and scheduled a consultation for a new, better-fitting set.",1
61,Inquired about the cost of a dental sealant for their child's molars and said they would have to pass for now due to other expenses.,"Provided the price for the preventative dental sealants, but the parent indicated that other financial obligations were taking priority at the moment.",0
62,Asked for the price of a full set of dental x-rays and seemed surprised that it would cost over $200 for the complete series.,"Informed the customer of the cost for a full-mouth series of x-rays, and their reaction suggested that the price was higher than they had anticipated.",0
63,Called to get a quote for a single dental implant to replace a missing tooth and said they would need to get a second opinion before deciding.,"Gave the customer a detailed quote for the dental implant, and they expressed a desire to consult with another dentist before making a final choice.",0
64,Requested the price of a take-home teeth whitening kit from the clinic and decided to just live with their teeth the way they are for now.,"Shared the price of the professional take-home whitening kits, and the customer ultimately decided against purchasing one at this time.",0
65,Asked about the cost of a new retainer after their dog chewed up their old one and said they couldn't afford a replacement at the moment.,"Informed the customer of the cost to replace their lost retainer, but they stated that they did not have the funds available for it right now.",0
66,Was experiencing extreme sensitivity to hot and cold in one of their teeth and was concerned enough to book a diagnostic appointment.,Listened to the patient's concerns about their extreme tooth sensitivity and scheduled a thorough diagnostic appointment to identify the cause.,1
67,Called to schedule their regular six-month check-up and cleaning and asked to be put on a cancellation list for an earlier opening.,Booked the patient's routine six-month appointment and also added them to the cancellation list in case an earlier time slot became available.,1
68,Had a filling fall out while eating and was eager to get it replaced before it started to cause any pain or further damage.,Understood the patient's desire to get their lost filling replaced quickly and was able to schedule a same-day appointment for the repair.,1
69,"Asked to book a consultation to discuss their options for cosmetic dentistry, as they were unhappy with the appearance of their smile.",Scheduled a comprehensive cosmetic dentistry consultation for the patient to explore various options for improving their smile with the dentist.,1
70,Called to make an appointment to have their teeth cleaned before a big event they had coming up in a few weeks.,Helped the patient find a convenient appointment time for a dental cleaning to ensure their smile was looking its best for their upcoming special event.,1
71,Inquired about the cost of a bone grafting procedure needed for a future dental implant and seemed discouraged by the high price tag.,"Explained the necessity and cost of the bone grafting procedure, but the customer's response indicated that the price was a significant deterrent for them.",0
72,Asked for the price of an Invisalign treatment and said they would have to do some serious budgeting to be able to afford the clear aligners.,"Provided a detailed breakdown of the costs for an Invisalign treatment, and the customer acknowledged that it would require careful financial planning.",0
73,Called to get a quote for a root canal and crown on a molar and expressed that the combined cost was simply out of their reach financially.,"Gave the customer a combined quote for both the root canal and the crown, and they were clear that the total amount was not affordable for them.",0
74,Requested the price of a fluoride treatment for their child and decided it wasn't a necessary expense for them at this time.,"Shared the price of a professional fluoride treatment, but the parent made the choice to decline the preventative service for now.",0
75,Asked about the cost of a dental consultation for a second opinion and said they found another office that offered it for free.,"Informed the customer of our consultation fee for a second opinion, and they indicated that they had found a competitor who provided it at no charge.",0
76,"Was worried about a persistent bad taste in their mouth and a swollen jaw, and they booked an urgent appointment to get it checked out.",Recognized the potential signs of an infection from the patient's description and scheduled an urgent care appointment to diagnose the issue.,1
77,Called to schedule a pre-operative dental clearance appointment that was required by their doctor before an upcoming heart surgery.,Understood the importance of the pre-operative dental clearance and scheduled the patient for a priority appointment to meet their surgeon's requirements.,1
78,"Had a dental appliance that needed to be adjusted because it was causing them some discomfort, and they booked an appointment for the next day.",Listened to the patient's concerns about the uncomfortable dental appliance and scheduled them for an adjustment appointment at their earliest convenience.,1
79,"Asked to book an appointment to get a custom night guard fitted, as they were experiencing headaches from grinding their teeth at night.",Scheduled an appointment for the patient to get a custom-fitted night guard to help alleviate their headaches and protect their teeth from grinding.,1
80,"Called to make their first-ever dental appointment as an adult, and they were happy to be scheduled for a comprehensive new patient exam.",Welcomed the new patient to our practice and scheduled them for a complete and thorough initial dental examination to assess their oral health.,1
81,Inquired about the cost of a space maintainer for their child who had lost a baby tooth prematurely and said it seemed too expensive.,"Explained the purpose and cost of a space maintainer, but the parent expressed that the price was a barrier to getting the recommended treatment.",0
82,Asked for the price of a professional dental cleaning and polishing and commented that they could get it done cheaper at the local dental school.,"Provided the price for our cleaning and polishing service, and the customer mentioned that they were aware of a lower-cost option at a dental school.",0
83,Called to get a quote for a full set of immediate dentures to be placed right after extractions and seemed shocked by the overall cost.,"Gave the customer a comprehensive quote for the immediate denture process, but their reaction suggested the total price was much higher than expected.",0
84,Requested the price of a new dental crown after their old one broke and said they would have to live with the broken tooth for a while.,"Informed the customer of the cost to replace their broken crown, and they indicated that they would have to postpone the treatment for financial reasons.",0
85,Asked about the cost of a consultation with the cosmetic dentist and decided not to book when they found out the fee was not applied to treatment.,"Clarified that the cosmetic consultation fee was separate from the treatment cost, and the customer chose not to schedule the appointment.",0
86,"Was experiencing a sharp, shooting pain in their jaw whenever they chewed and was anxious to get a diagnosis as soon as possible.",Understood the patient's anxiety about the sharp jaw pain and scheduled them for a diagnostic appointment to determine the cause of the problem.,1
87,Called to schedule a dental appointment for their entire family of four and was pleased to find a block of time that could accommodate everyone.,Successfully found and booked a block of appointments to allow the entire family to be seen for their dental check-ups on the same day.,1
88,Had a new dental insurance plan and wanted to come in for a check-up and cleaning to take advantage of their new benefits.,Welcomed the patient with their new insurance and scheduled them for a comprehensive exam and cleaning to utilize their dental benefits.,1
89,Asked to book a follow-up appointment to have their stitches removed after a recent oral surgery procedure.,Scheduled a convenient post-operative appointment for the patient to have their sutures removed by the clinical team.,1
90,"Called to make an appointment to discuss getting veneers, as they were finally ready to invest in the smile they had always wanted.",Scheduled a cosmetic consultation for the patient who was excited and ready to move forward with getting porcelain veneers.,1
91,Inquired about the cost of a new partial denture and said they needed to talk to their kids about helping them with the expense.,"Provided the price for the new partial denture, and the customer mentioned that they would need to have a conversation with their family about financial assistance.",0
