lead_id,customer_summary,agent_summary,conversion_label
768,"Called to make an appointment to have their teeth cleaned before a big family reunion, as they wanted to look their best for the family photos.",Understood the patient's motivation and scheduled them for a cleaning and polishing to help them feel confident and smile brightly at their family reunion.,1
769,Asked for the price of an exam and then wanted to know if we had a dentist on staff who was also a licensed therapist to help with their anxiety.,"Informed the customer of the fee and explained that while our dentists are trained to handle anxiety, they are not licensed therapists, which made the patient hesitant.",0
770,"Was in a lot of pain from a tooth that had a very large, old silver filling and was now cracking, and they wanted it crowned as soon as possible.",Understood the urgency of the situation and scheduled a prompt appointment to prepare the cracking tooth for a new crown to prevent it from breaking completely.,1
771,Inquired about the cost of Invisalign and said they would have to choose between getting straight teeth or going on their dream trip to Europe.,"Provided the full cost for the Invisalign treatment, and the customer framed the decision as a major choice between self-investment and a significant life experience.",0
772,Called to schedule a new patient appointment after their previous dentist's office had closed permanently with very little notice.,Welcomed the patient and offered to assist them in obtaining their dental records from their former dentist's office to ensure a smooth transition of care.,1
773,Asked for the price of a new partial denture and then asked if we could use a mold of their teeth that they had made themselves with a kit from the internet.,Informed the customer of the price and had to firmly explain that we cannot use an inaccurate and unsafe at-home mold to fabricate a medical device.,0
774,"Had a temporary crown that was too big and bulky, and it was bothering their tongue and cheek, so they wanted to come in to have it reshaped.",Listened to the patient's complaint and scheduled them for a prompt appointment to have the temporary crown adjusted and recontoured for better comfort.,1
775,Requested the price of a smile makeover and then asked if they could get a discount by paying for it with a valuable painting from their art collection.,Shared the estimated cost for the makeover and had to politely explain that our office policy does not allow us to accept artwork or other goods as payment.,0
776,"Called to make an appointment for their child who had a cavity, and they were happy to learn we offered tooth-colored fillings instead of silver ones.","Reassured the parent that we use modern, aesthetic materials and scheduled the child for their appointment to get a white composite filling.",1
777,Inquired about the cost of a dental implant and said they would have to wait for their legal case against their employer to settle before they could afford it.,"Provided the cost for the implant, and the customer stated that their ability to proceed with treatment was dependent on the outcome of a lawsuit.",0
778,Was experiencing a lot of sensitivity and discomfort around an old bridge and was worried that one of the supporting teeth had a problem.,Took the patient's concern seriously and scheduled an appointment to take x-rays and evaluate the health of the abutment teeth under the old bridge.,1
779,Asked for the price of a check-up and then wanted to know if they could get a discount for having a 'perfect' set of teeth with no cavities.,"Informed the customer of the standard fee and explained that the price is for the professional evaluation, not contingent on the results, but they felt they deserved a discount.",0
780,"Called to book an appointment to finally get a dental implant for a tooth that was extracted over a year ago, stating they were tired of the empty space.",Congratulated the patient on their decision and scheduled them for an implant consultation to get the process started on restoring their smile.,1
781,"Inquired about the cost of a full mouth reconstruction and said that for that kind of money, they could have bought a racehorse.","Provided the extensive quote for the reconstruction, and the customer responded with a dramatic comparison of the cost to that of purchasing a thoroughbred racehorse.",0
782,"Had a permanent crown fall off and they had lost it, and they were very anxious to get a new one made as soon as possible.",Understood the patient's urgency and scheduled them for an appointment to have a new impression taken for a replacement crown and a temporary placed.,1
783,Asked for the price of a deep cleaning and then asked if they could just have the hygienist show them how to do it so they could do it on themselves at home.,Explained that a deep cleaning is a complex medical procedure that cannot be performed by oneself and requires professional skill and instruments.,0
784,Called to schedule their daughter's six-month cleaning appointment and was happy to get an after-school time slot so she wouldn't have to miss any class.,Found a convenient after-school appointment for the patient's daughter and scheduled her for her routine dental cleaning and check-up.,1
785,Requested the price of a cosmetic bonding procedure and decided they would just try to stand in the back during group photos to hide their teeth.,"Shared the price for the bonding, and the customer opted to change their social behavior to hide the cosmetic flaw rather than pay for the treatment.",0
786,"Woke up with a very painful and swollen jaw and was unable to close their teeth together properly, so they booked an emergency appointment.",Recognized the signs of a significant TMJ issue or infection and scheduled an immediate emergency appointment to diagnose the cause of the swelling and malocclusion.,1
787,Inquired about the cost of a new partial denture and said they would have to see if they were approved for a small personal loan from their bank.,"Provided the cost for the partial, and the customer indicated that their ability to get the treatment was dependent on being approved for a bank loan.",0
788,"Called to schedule a new patient visit, mentioning that they had severe dental anxiety and had heard our office offered oral sedation options.","Welcomed the patient and reassured them that we could help, scheduling them for a consultation to discuss their anxiety and the oral sedation process.",1
789,Asked for the price of a routine dental cleaning and then wanted to know if they could get a discount if they didn't ask any questions during the visit.,"Informed the customer of the standard fee and explained that patient education and questions are encouraged and part of the service, not something to be discounted.",0
790,"Had a bracket on their braces come loose, and the orthodontist was on vacation, so they were relieved we could see them to at least clip the wire.",Understood the situation and scheduled the patient for a quick emergency visit to clip the poking wire for comfort until their orthodontist returned.,1
791,Inquired about the cost of a smile makeover with veneers and said the price was so high it would be cheaper to just fly all their friends to a different country for vacation.,"Provided the detailed quote for the smile makeover, and the customer responded with a dramatic and unrelated comparison of the cost to an international trip.",0
792,"Called to book an appointment for a consultation about a discolored tooth, mentioning they were tired of trying to photoshop it in every picture they took.",Showed empathy for the patient's frustration and scheduled a cosmetic consultation to discuss a permanent clinical solution for their discolored tooth.,1
793,Asked for the price of a root canal and then asked if we could just write them a prescription for painkillers so they could put off the treatment.,Informed the customer of the root canal fee and had to explain our policy against prescribing narcotics without a proper examination and treatment plan.,0
794,Was experiencing a lot of bleeding from their gums when brushing and was worried they had inherited their mother's severe gum disease.,Took the patient's concern about their genetic predisposition seriously and scheduled a comprehensive periodontal evaluation to assess their gum health.,1
795,Requested the price of a custom-made snore guard and decided they would just sew a tennis ball onto the back of their pajamas to keep from sleeping on their back.,"Shared the price for the clinical snore guard, and the customer opted to try a common, although often uncomfortable, behavioral home remedy instead.",0
796,"Called to make an appointment to have a filling replaced that had fallen out, mentioning it was now very sensitive to sugar.",Recognized that sensitivity to sugar is a classic sign of exposed dentin and scheduled the patient for a prompt appointment to replace the lost filling.,1
797,Inquired about the cost of a new dental crown and said they would have to wait until they received their 'end of year' work bonus to pay for it.,"Provided the cost for the crown, and the customer stated that the treatment was contingent on receiving their annual performance bonus from work.",0
798,Had a very sore and inflamed area on their gums and was relieved to be scheduled for a cleaning to have the area properly debrided.,Recognized that the localized gingivitis needed professional attention and scheduled the patient for a cleaning to resolve the inflammation.,1
799,Asked for the price of an exam and then wanted to know if they could get a discount if they brought their own dental mirror and explorer to help out.,"Informed the customer of the fee and had to politely explain that for safety and sterilization reasons, patients cannot use their own instruments during an exam.",0
800,"Called to book an appointment for a second opinion on a recommendation for four crowns, stating they felt it was overly aggressive treatment.",Respected the patient's intuition and scheduled them for a comprehensive second opinion to evaluate if the four crowns were truly medically necessary.,1
801,Inquired about the cost of a full set of porcelain veneers and said the total price was more than their wedding had cost.,"Provided the quote for the full veneer case, and the customer responded by directly comparing the significant dental fee to the cost of their entire wedding.",0
802,"Called to schedule a cleaning for their child, mentioning they needed a form signed for summer camp that required a dental check-up within the last year.","Understood the camp requirement and scheduled the child for their cleaning and exam, ensuring the necessary forms would be ready and signed at the visit.",1
803,Asked for the price of a new partial denture and said they would have to sell their collection of vintage guitars to be able to afford it.,"Informed the customer of the price for the partial, and they responded that it would require them to sell a valuable and sentimental personal collection.",0
804,"Was having a lot of trouble eating because their lower denture kept lifting up, and they were eager to come in for an adjustment or reline.",Recognized the functional problem with the loose lower denture and scheduled the patient for an appointment to assess the fit and provide a solution.,1
805,Requested the price of a dental bonding procedure and decided they would just use a social media filter that made their teeth look better in videos.,"Shared the price for the clinical bonding procedure, and the customer opted for a purely digital enhancement for their videos rather than a physical fix.",0
806,"Called to make an appointment to have their wisdom teeth checked, as they were causing a dull, constant pressure in the back of their jaw.","Listened to the patient's symptoms and scheduled a consultation, including a panoramic x-ray, to evaluate the position of their wisdom teeth.",1
807,Inquired about the cost of a new dental bridge and said they would have to take on extra shifts at work for the next few months to pay for it.,"Provided the price for the bridge, and the customer calculated and commented that they would need to work extra hours for several months to cover the cost.",0
808,"Had a very bad taste coming from an old crown and was worried that there was decay underneath it, so they booked an appointment to have it checked.",Understood the patient's concern and scheduled an appointment to take an x-ray and clinically evaluate the integrity of the old crown.,1
809,Asked for the price of a deep cleaning and then wanted to know if the price would be lower if they only had half of their mouth done.,"Explained the pricing for a full-mouth treatment versus per-quadrant, which allowed the customer to consider a phased treatment to manage the cost.",0
810,"Called to book an appointment to get a referral to an oral surgeon, as their wisdom tooth was impacted in a very complicated way near a nerve.",Scheduled the patient for an evaluation and to get a copy of their panoramic x-ray to provide them with a referral to the appropriate oral surgeon.,1
811,Inquired about the cost of a full mouth reconstruction and said they would have to sell their shares in a tech company to fund the treatment.,"Provided the extensive quote for the reconstruction, and the customer indicated that it would require them to liquidate a significant stock market investment.",0
812,"Was very happy to schedule a new patient appointment, mentioning they had just received a great dental insurance plan as a new union member.","Welcomed the new patient and scheduled their comprehensive exam, congratulating them on their new and excellent union-provided dental benefits.",1
813,Asked for the price of a cleaning and then hung up when the receptionist asked for their name and phone number to create a chart.,"Began the new patient registration process after quoting the fee, but the customer was unwilling to provide their personal information and ended the call.",0
814,"Called to book an appointment for their daughter to have her braces removed, as she had finally completed her orthodontic treatment.","Celebrated the exciting milestone with the parent and scheduled the daughter for her 'de-banding' appointment to finally reveal her new, straight smile.",1
815,Requested the price of a cosmetic contouring of their front teeth and decided they would rather use the money to buy a new high-end bicycle.,"Shared the price for the cosmetic contouring, and the customer made a clear choice to prioritize a recreational purchase over the dental treatment.",0
816,"Had a tooth that was extremely sensitive to hot liquids, a classic sign of an irreversible nerve problem, and booked an urgent evaluation.",Recognized the tell-tale sign of irreversible pulpitis and scheduled an urgent appointment to evaluate the tooth for probable root canal therapy.,1
817,Inquired about the cost of a new partial denture and said they would have to ask their adult children for an early inheritance to pay for it.,"Provided the cost for the new partial, and the customer responded, perhaps half-jokingly, that they would need to ask for an advance on their inheritance.",0
818,"Called to schedule an appointment for a cleaning, mentioning they wanted to do it before their upcoming open-heart surgery, as advised by their surgeon.",Recognized the critical importance of pre-surgical dental clearance and scheduled the patient for a priority appointment before their heart surgery.,1
819,Asked for the price of a root canal and then wanted to know if they could get it done without any x-rays to save money on the total cost.,Informed the customer of the fee and had to firmly explain that performing a root canal without the necessary diagnostic x-rays is impossible and unsafe.,0
820,Was experiencing a lot of pain and a feeling of pressure underneath a dental bridge and was worried one of the anchor teeth was failing.,Understood the patient's intent and scheduled an appointment immediately.,1
821,Inquired about the cost of a dental implant and said they would have to sell their collection of rare stamps to be able to afford the procedure.,"Provided the total cost for the dental implant procedure, and the customer responded that it would require them to sell a valuable personal collection to cover the expense.",0
822,"Called to schedule a new patient appointment, mentioning they had just been diagnosed with an autoimmune condition and their rheumatologist recommended a thorough dental exam.",Understood the systemic health connection and scheduled the new patient for a comprehensive periodontal and dental evaluation as per their specialist's recommendation.,1
823,"Asked for the price of a dental cleaning and then wanted to know if they could get a discount if they paid in a foreign currency, which we cannot accept.",Informed the customer of the standard fee in local currency and had to explain that we are not equipped to accept or process payments in foreign currency.,0
824,"Was experiencing sharp pain and sensitivity from a tooth with a large, old filling and was worried it was cracked internally, so they booked an urgent visit.",Recognized the classic signs of a cracked tooth and scheduled an urgent appointment to evaluate the tooth for a fracture and discuss treatment options like a crown.,1
825,"Requested the price of a smile makeover with veneers and then asked if we offered financing through a 'buy now, pay later' service like Afterpay or Klarna, which we do not.","Shared the estimated cost for the smile makeover and had to inform the customer that we do not partner with those specific 'buy now, pay later' services.",0
826,Called to make an appointment for their child who had just gotten their permanent molars and wanted to get protective dental sealants placed on them.,Commended the parent for their proactive approach to preventative care and scheduled an appointment to have the dental sealants applied to the child's new molars.,1
827,"Inquired about the cost of a new dental crown and said they would just have to hope the broken tooth didn't get any worse, as their credit card was maxed out.","Provided the price for the crown, and the customer stated that their current credit limit and lack of available funds prevented them from proceeding with the treatment.",0
828,"Had a very painful canker sore right on the tip of their tongue that was making it difficult to talk and eat, and they were desperate for some relief.",Showed empathy for the patient's severe discomfort and scheduled them for a palliative care visit to have a topical anesthetic or laser treatment applied.,1
829,Called to get a quote for a root canal and then said they had read about 'oil pulling' online and were going to try that to heal the tooth naturally first.,Gave the customer the quote for the root canal and advised them that oil pulling is not a clinically proven substitute for treating an infected tooth.,0
830,"Called to book a consultation for a smile makeover, admitting they had recently gone through a divorce and wanted a fresh start and a confidence boost.",Showed empathy and support for the patient's new chapter in life and scheduled them for a comprehensive cosmetic consultation to help them achieve their goals.,1
831,Inquired about the cost of Invisalign and said they found an online company that would send them aligners directly for a quarter of the price.,"Provided the cost for our dentist-supervised Invisalign treatment and cautioned about the risks of DIY aligners, but the customer was focused on the much lower price.",0
832,"Was very happy to schedule a cleaning and check-up, mentioning they had just recovered from a long illness and were now focused on getting their health back on track.",Congratulated the patient on their recovery and scheduled them for a comprehensive exam and cleaning to support their journey back to overall health.,1
833,Asked for the price of a deep gum cleaning and then asked if the hygienist could just use a 'manual scraper' instead of the 'ultrasonic thing' to make it cheaper.,"Explained that the fee is for the medical procedure itself, not the specific instruments used, and that both are often required for the best result.",0
834,"Called to schedule an appointment to have a permanent retainer removed that had been bothering them for years, stating they were tired of the constant irritation.",Understood the patient's long-term frustration and scheduled an appointment to have the permanent retainer safely and completely removed from their teeth.,1
835,Requested the price of a custom night guard and then said they were just going to buy a generic one from a website they saw advertised on social media.,"Shared the price for our professionally fitted night guard, but the customer opted for a cheaper, direct-to-consumer product they found through an online ad.",0
836,"Had a child who had fallen and bumped their front teeth, and while they didn't seem loose, the parent wanted them checked for any unseen damage.",Commended the parent for being cautious and scheduled the child for an evaluation and x-ray to check for any trauma to the roots or underlying permanent teeth.,1
837,Inquired about the cost of a new dental bridge and said they would have to wait for the company they worked for to go public and cash in their stock options.,"Provided the price for the bridge, and the customer indicated that their ability to pay for the treatment was contingent on a future financial event at their company.",0
838,"Called to book an appointment to have their teeth whitened, mentioning they were going to be the maid of honor in their best friend's wedding.",Understood the importance of the event and scheduled the patient for a professional whitening session to ensure their smile was bright for the wedding photos.,1
839,Asked for the price of an emergency exam and then said they read a negative online review about that specific procedure and were now too scared to come in.,"Attempted to reassure the customer about the safety and efficacy of the procedure, but their fear, prompted by an online review, prevented them from booking.",0
840,"Was experiencing a lot of pain when chewing, and they were worried a tooth that had a root canal years ago had failed and become reinfected.",Recognized the signs of a possible root canal failure and scheduled an urgent appointment for an evaluation and x-ray to check the status of the tooth.,1
841,Inquired about the cost of a full mouth of crowns and said the price was so high they would have to cancel the backyard swimming pool they were planning to build.,"Provided the extensive quote for the full mouth of crowns, and the customer responded by comparing the cost to a major home improvement project.",0
842,"Called to schedule a cleaning, mentioning they needed a dental clearance form signed before they could start their new job as a commercial pilot.",Understood the specific occupational requirement and scheduled the patient for a comprehensive exam to provide the necessary dental clearance for their pilot's license.,1
843,"Asked for the price of a new patient exam and then asked if our office was considered 'holistic' or 'biomimetic,' as that was the only type of dentistry they would consider.","Explained our practice philosophy and, since we don't specifically use those marketing terms, the customer decided we were not the right fit for them.",0
844,"Had an orthodontic expander that had gotten stuck, and the parent was unable to turn it, so they were relieved we could see their child right away.",Recognized the urgency of the orthodontic appliance issue and scheduled the child for an immediate appointment to have the expander evaluated and adjusted.,1
845,Requested the price of a cosmetic bonding to fix a chip and said they would just wait until their work's 'wellness benefit' renewed in the new year.,"Shared the price for the bonding, and the customer decided to postpone the treatment until their employer-provided wellness funds were replenished.",0
846,"Called to make an appointment to have their teeth cleaned and polished, admitting that they had a first date with someone they met online and wanted to make a good impression.",Showed support for the patient's exciting social event and scheduled them for a cleaning and polishing to help boost their confidence for their first date.,1
847,Inquired about the cost of a new partial denture and said they would have to wait for their farm's crop to sell at the end of the season to have the money.,"Provided the cost for the new partial, and the customer explained that their income was seasonal and they would have the funds after their harvest was sold.",0
848,"Was having trouble with their Invisalign aligner not fitting properly on one tooth, and they wanted to come in to have it checked.",Understood that a poor-fitting aligner can disrupt treatment and scheduled the patient for a prompt appointment to check the aligner and the tooth's tracking.,1
849,Asked for the price of a root canal and then said they were going to get a second opinion because they didn't believe the tooth was actually infected.,"Provided the price for the root canal and respected the patient's right to a second opinion, as they were questioning the initial diagnosis they received.",0
850,"Called to schedule a new patient appointment, mentioning they had just completed chemotherapy and their oncologist had cleared them to resume dental care.",Warmly congratulated the patient on finishing their treatment and scheduled them for a gentle but comprehensive exam to get their oral health back on track.,1
