lead_id,customer_summary,agent_summary,conversion_label
350,"Called to make an appointment for a check-up, mentioning they had recently quit smoking and were now motivated to take better care of their teeth and gums.",Congratulated the patient on quitting smoking and scheduled them for a comprehensive exam and cleaning to support their new health goals.,1
351,Inquired about the price of a full set of immediate dentures placed on the same day as extractions and said the cost was 'breathtakingly high'.,"Provided the comprehensive quote for the immediate denture surgery and prosthetics, and the customer described the total cost as 'breathtakingly high'.",0
352,Asked for the cost of a deep cleaning (scaling and root planing) and then asked if we could just do a 'really good regular cleaning' instead for a lower price.,"Explained that a deep cleaning was a medically necessary treatment for gum disease that couldn't be substituted with a standard cleaning, despite the price difference.",0
353,Called to get a price for a new lower partial denture and said they would have to talk to their children about helping them out with the cost.,"Gave the customer the price for the new lower partial, and they mentioned that they would need to seek financial assistance from their adult children.",0
354,Requested a quote for a 'Hollywood smile' with 10 porcelain veneers and seemed deflated when they realized the cost was similar to that of a new car.,"Provided a detailed quote for the 10-veneer smile makeover, and the customer seemed disheartened when they compared the significant cost to that of a new vehicle.",0
355,Asked about the cost of an emergency tooth extraction and said they would just go to the public health dental clinic and wait in line all day.,"Informed the customer of our emergency extraction fee, and they opted to try and get service at a public health clinic, despite the potential for a long wait.",0
356,"Was in a lot of pain and had a visible 'pimple' on their gum above a tooth, and they were worried it was a serious infection.","Recognized the 'pimple' as a fistula, a sign of a chronic abscess, and scheduled the patient for an urgent appointment for diagnosis and treatment.",1
357,"Called to schedule a routine cleaning for themselves and their spouse, and they were happy to be able to get back-to-back appointments on the same day.",Found a time slot that could accommodate both the patient and their spouse and scheduled them for convenient back-to-back cleaning appointments.,1
358,Had a new crown fall off just days after it was permanently cemented and was very upset and wanted it fixed immediately.,Apologized for the inconvenience and scheduled the patient for an immediate emergency appointment to have the crown re-cemented and the bite checked.,1
359,"Asked to book an appointment for their daughter to be fitted for a sports mouthguard, as she was about to start playing field hockey.",Scheduled an appointment to take an impression for a custom-fitted sports mouthguard to provide the best protection for the daughter's teeth during her sport.,1
360,"Called to make an appointment to start their Invisalign treatment, having just received a large tax refund that they had earmarked for the procedure.","Congratulated the patient and scheduled them to begin their Invisalign treatment, which they were now able to afford thanks to their recent tax refund.",1
361,Inquired about the cost of a new dental bridge and said they would have to cancel their family vacation to be able to afford it.,"Provided the price for the new dental bridge, and the customer remarked that they would have to sacrifice their planned family vacation to cover the cost.",0
362,Asked for the price of a new patient exam and then said they would only come in if the dentist could promise not to lecture them about their oral health.,"Informed the customer of the new patient fee and reassured them that our office provides a judgment-free environment, but they remained hesitant to book.",0
363,Called to get a quote for a root canal and crown and asked if there was any 'unseen' or 'hidden' fees they should know about.,Provided a comprehensive quote for the root canal and crown and reassured the customer that our estimate included all standard associated fees for the procedures.,0
364,Requested the price of a custom whitening tray and said their friend could probably 3D-print one for them for much cheaper.,"Shared the price for our professionally made whitening trays, and the customer mentioned the possibility of getting a cheaper, 3D-printed version from a friend.",0
365,"Asked about the cost of a replacement partial denture and said they would just try to superglue their old, broken one back together for now.","Informed the customer of the cost for a new partial and strongly advised against using superglue on their broken one, but they seemed intent on trying it.",0
366,"Was experiencing a bizarre metallic taste in their mouth and was concerned it was coming from one of their old, silver fillings.",Listened to the patient's concern about the metallic taste and scheduled a diagnostic appointment to evaluate their amalgam fillings and overall oral health.,1
367,"Called to schedule a dental check-up, mentioning they had recently been diagnosed with sleep apnea and their doctor recommended a dental evaluation.","Understood the connection between sleep apnea and oral health and scheduled the patient for a comprehensive exam, including an airway assessment.",1
368,Had a temporary crown on a front tooth fall off right before a family wedding and was in a panic to get it put back on.,Recognized the social urgency of the situation and was able to squeeze the patient in for an emergency appointment to re-cement their front temporary crown.,1
369,"Asked to book a consultation to discuss alternatives to a CPAP machine for their sleep apnea, such as a mandibular advancement device.",Scheduled a consultation for the patient to discuss their sleep apnea and to see if they were a suitable candidate for a custom-made oral appliance.,1
370,"Called to make an appointment for a cleaning, as they were a new patient who had chosen our office from their insurance company's provider list.",Welcomed the new patient who had found us through their insurance plan and scheduled them for their first comprehensive cleaning and exam with our team.,1
371,Inquired about the cost of a full set of premium cosmetic veneers and said they would need to sell some stocks to be able to afford the treatment.,"Provided the high-end cost for the premium veneers, and the customer indicated that they would need to liquidate some of their stock market investments to pay for them.",0
372,Asked for the price of a routine check-up and said they would only book if they could be guaranteed to be in and out in under 30 minutes.,"Informed the customer of our fee for a check-up and explained that while we are efficient, we could not guarantee a specific time frame for a thorough exam.",0
373,Called to get a quote for a new set of dentures and seemed suspicious about the price difference between the 'basic' and 'premium' options.,"Explained the differences in materials, aesthetics, and fit between our basic and premium denture options, but the customer remained skeptical of the value.",0
374,Requested the price of a dental bonding procedure to fix a small chip and decided it was a vanity expense they couldn't justify to their spouse.,"Shared the price for the cosmetic bonding, and the customer concluded that they would not be able to justify the 'vanity' expense to their partner.",0
375,Asked about the cost of a new patient visit and said they would have to wait and see if their application for a healthcare credit card was approved.,"Informed the customer of the new patient visit cost, and they stated that their ability to schedule was dependent on the approval of their healthcare financing application.",0
376,Was in a lot of pain and couldn't close their teeth together properly after a new filling was placed yesterday at another dental office.,Recognized the signs of a high filling and scheduled the patient for an immediate emergency bite adjustment to relieve their pain and discomfort.,1
377,"Called to schedule a dental cleaning for their child who has autism, asking if they could have the first appointment of the day when the office was quiet.","Showed understanding and accommodated the request by scheduling the child for the first appointment of the day to ensure a calmer, quieter environment.",1
378,"Had a temporary bridge come off while eating and was worried about the appearance of their front teeth, so they booked an immediate appointment.",Understood the cosmetic emergency of losing a front temporary bridge and scheduled the patient for an immediate appointment to have it re-cemented.,1
379,"Asked to book an appointment to get a second opinion on a recommendation for gum surgery, as they wanted to explore all non-surgical options first.",Scheduled a comprehensive periodontal evaluation for the patient to get a second opinion and to thoroughly discuss all available non-surgical treatment alternatives.,1
380,"Called to make an appointment for a check-up, mentioning that they had a dental phobia and required a dentist who was very patient and gentle.",Reassured the patient that our dentists are experienced with anxious patients and scheduled them for a gentle exam with our most patient provider.,1
381,Inquired about the cost of Invisalign and said they would have to compare that to the cost of a destination wedding they were planning.,"Provided the full cost of Invisalign treatment, and the customer remarked that they would have to weigh that expense against the cost of their planned wedding.",0
382,"Asked for the price of a dental exam and cleaning and then asked for a detailed, line-by-line breakdown of every single charge.","Provided the customer with our standard fee and offered to send them a detailed breakdown of the services included, but their questioning tone suggested distrust.",0
383,Called to get a quote for a root canal and said they heard you could get them done much cheaper in Mexico and were considering a trip.,"Gave the customer our fee for a root canal, and they openly stated that they were considering dental tourism in Mexico as a more affordable option.",0
384,Requested the price of a cosmetic teeth contouring (enameloplasty) and decided they would just try to file their own tooth with a nail file at home.,"Shared the price for the professional contouring and strongly advised against any DIY home dentistry, but the customer seemed to be considering it.",0
385,Asked about the cost of an emergency visit and said they would just go to their primary care physician to try and get a prescription for antibiotics.,"Informed the customer of our emergency visit fee, and they opted to see their medical doctor, likely for antibiotics, which would not resolve the underlying dental problem.",0
386,"Was experiencing a sudden, intense pain in their jaw joint and couldn't open their mouth wide, and they were worried they had dislocated it.",Listened to the patient's description of acute TMJ pain and scheduled an urgent appointment to evaluate their jaw and provide palliative care.,1
387,"Called to schedule a dental check-up, as they were newly pregnant and wanted to be proactive about their oral health during pregnancy.","Congratulated the expectant mother and scheduled her for a comprehensive and safe dental check-up, emphasizing the importance of oral health during pregnancy.",1
388,"Had the porcelain fracture off a crown on a front tooth, leaving an unsightly metal base, and they were desperate for a same-day cosmetic repair.",Recognized the cosmetic urgency of the fractured porcelain and scheduled the patient for a same-day appointment to have a temporary cosmetic repair done.,1
389,"Asked to book a consultation to discuss getting a Snap-On Smile as a temporary, non-invasive cosmetic solution for an upcoming event.",Scheduled a consultation for the patient to see if they were a good candidate for a Snap-On Smile and to take impressions for the custom appliance.,1
390,"Called to make an appointment to have a dark stain on their front tooth looked at, as it was making them very self-conscious when they smiled.",Understood the patient's cosmetic concern and scheduled them for a diagnostic appointment to identify the cause of the stain and discuss removal options.,1
391,Inquired about the cost of a new set of flexible partial dentures and said the price was 'laughable' and they would have to go without.,"Provided the cost for the flexible partial dentures, and the customer responded with derision, stating the price was 'laughable' and they would not proceed.",0
392,"Asked for the price of a routine cleaning and then said they would only book if we could promise not to take any x-rays, no matter what.","Informed the customer of the cleaning fee but also explained our policy on diagnostic x-rays, which led to the customer declining to book an appointment.",0
393,Called to get a quote for a new set of dentures and asked if the price would be lower if they had their own teeth extracted by a dental student.,Provided our quote for new dentures and had to explain that we could not discount the price based on who performed the necessary prerequisite extractions.,0
394,Requested the price of a full smile makeover and then asked if we offered a payment plan with zero interest for five years.,"Shared the estimated cost for the smile makeover and had to inform the customer that while we offer financing, it does not include a five-year, zero-interest plan.",0
395,Asked about the cost of an after-hours emergency visit and said they would just use an Orajel-type product and drink whiskey for the pain.,"Informed the customer of the after-hours emergency fee, and they responded that they would be self-treating with topical anesthetics and alcohol.",0
396,Was in a lot of pain and their jaw was swollen up like a balloon after a tooth extraction a couple of days ago at another office.,"Recognized the signs of a post-operative infection and, despite being from another office, scheduled the patient for an immediate emergency follow-up visit.",1
397,"Called to schedule a dental cleaning, mentioning they needed to have a 'healthy mouth' certificate for an international adoption they were processing.",Understood the specific documentation required and scheduled the patient for a full exam and cleaning to provide them with the necessary adoption paperwork.,1
398,"Had a veneer on their front tooth pop off while they were eating, and they were very careful to save it and were relieved to get a same-day appointment.",Praised the patient for saving the veneer and scheduled them for a same-day appointment to have it cleaned and re-bonded to their tooth.,1
399,Asked to book an appointment for a consultation about a gum bleaching procedure to lighten their dark-pigmented gums.,Scheduled a consultation for the patient to discuss the innovative procedure of gum bleaching (gingival depigmentation) with the cosmetic dentist.,1
400,"Called to make their first dental appointment in many years, admitting that a recent health scare had motivated them to finally take care of themselves.",Commended the patient for their proactive decision and scheduled them for a comprehensive and non-judgmental new patient exam to get them back on track.,1
401,Inquired about the price of a full set of implant-supported dentures and said the cost was equivalent to their child's first year of college tuition.,"Provided the comprehensive cost for implant-supported dentures, and the customer made a stark comparison between the dental fees and college tuition.",0
402,Asked for the price of a dental cleaning and then asked if the price included the 'fancy water-spraying thing' or if that was extra.,"Reassured the customer that the use of the ultrasonic scaler was included in the standard cleaning fee and was not an additional charge, but they remained suspicious.",0
403,Called to get a quote for a new dental crown and asked if they could supply their own gold to the lab to reduce the material cost.,"Gave the customer the price for a new gold crown and had to explain that for safety and quality control reasons, we cannot use patient-supplied materials.",0
404,Requested the price of a cosmetic gingivectomy and said they would have to choose between getting the gum surgery or going on a cruise.,"Shared the price for the cosmetic gingivectomy, and the customer stated they had to make a choice between the dental procedure and a planned cruise vacation.",0
405,Asked about the cost of an emergency root canal on a weekend and said they would just pray the pain went away on its own by Monday.,"Informed the customer of the weekend emergency root canal fee, and they opted to take no action, instead hoping that the pain would resolve itself over time.",0
406,"Was experiencing a sudden, sharp, and shooting pain on one side of their face and was worried they had trigeminal neuralgia, so they booked an evaluation.",Listened to the patient's serious concerns and scheduled a thorough diagnostic evaluation to help differentiate between dental pain and potential neuralgia.,1
407,"Called to schedule a routine cleaning and exam, mentioning they had just gotten a new job with excellent dental insurance benefits.",Congratulated the patient on their new job and scheduled them for a comprehensive exam and cleaning so they could take full advantage of their new benefits.,1
408,"Had a temporary crown on a molar break, and the underlying tooth was extremely sensitive to air and water, so they needed an immediate fix.","Recognized the extreme sensitivity from the exposed tooth and scheduled the patient for an immediate appointment to have a new, well-sealed temporary crown made.",1
409,"Asked to book a consultation to discuss orthodontics for their child, as they were concerned about a significant overbite they had noticed.",Scheduled a comprehensive orthodontic consultation for the child to evaluate their overbite and discuss the best timing and options for correction.,1
410,"Called to make an appointment to have a tooth that had been bothering them for months finally looked at, stating they were tired of ignoring it.",Commended the patient for deciding to address the long-standing issue and scheduled a diagnostic appointment to finally resolve their dental problem.,1
411,Inquired about the cost of a full mouth rehabilitation with crowns and implants and said they would have to sell their motorcycle to help pay for it.,"Provided the extensive estimate for the full mouth rehabilitation, and the customer commented that they would need to sell a major asset like their motorcycle to fund it.",0
412,"Asked for the price of a check-up and then asked if the dentist was 'young or old,' stating they would only see an experienced, older dentist.","Informed the customer of the check-up fee and, while not able to guarantee a specific dentist, their unusual request made them hesitant to book with our diverse team.",0
413,Called to get a quote for a new partial denture and asked if the price would be cheaper if they took the impression of their own mouth at home.,Gave the customer the price for the partial denture and had to firmly explain the dangers and inaccuracies of taking one's own dental impressions at home.,0
414,Requested the price of a full set of porcelain veneers and then asked if we offered a 'reality TV' discount if they let us film their transformation.,Shared the standard price for a full set of veneers and had to politely decline the customer's creative but unfeasible request for a filming discount.,0
415,Asked about the cost of an emergency visit for a broken tooth and said they would just use a temporary filling kit from the drugstore until it fell out.,"Informed the customer of our emergency visit fee, and they opted to use a temporary, over-the-counter filling kit as a short-term, self-care solution.",0
416,"Was experiencing a persistent and unexplained toothache and was also having frequent headaches, and they wanted to see if the two were related.",Recognized the potential link between dental issues and headaches and scheduled the patient for a comprehensive exam to investigate the possible connection.,1
417,"Called to schedule a dental cleaning, mentioning they were getting married in a month and wanted their smile to be bright and clean for the photos.",Congratulated the patient on their upcoming wedding and scheduled them for a cleaning and polishing to ensure their smile was camera-ready for the big day.,1
418,"Had a permanent bridge come loose and it was rocking back and forth when they ate, and they were worried it would break the supporting teeth.",Understood the patient's concern about the potential damage to the abutment teeth and scheduled a priority appointment to have the loose bridge assessed.,1
419,Asked to book an appointment for their teenager who needed a clearance form signed by a dentist before they could get their braces put on.,Scheduled the teenager for a pre-orthodontic clearance exam to ensure their teeth and gums were healthy enough to begin their orthodontic treatment.,1
420,"Called to make an appointment to have a chipped tooth repaired, as they had been putting it off for a year and were now finally ready to fix it.",Welcomed the patient's decision to finally address the issue and scheduled them for a bonding appointment to repair the long-standing chip in their tooth.,1
421,Inquired about the cost of a single dental implant and said they would just have to leave the gap in their smile because the price was too high.,"Provided the total cost for the dental implant, and the customer resignedly stated that the price meant they would have to live with the empty space.",0
422,Asked for the price of a dental cleaning and then said they would only book if they could speak directly to the hygienist first to ask some questions.,"Offered to have the hygienist call them back when she was free, but the customer's unusual prerequisite and impatience led to them not booking.",0
423,Called to get a quote for a new set of dentures and asked if we could use the teeth from their old denture on the new one to save money.,"Gave the customer the quote for the new dentures and had to explain that for proper function and hygiene, we cannot transfer old prosthetic teeth to a new base.",0
424,Requested the price of a full smile makeover and then asked if the dentist would be willing to do it 'pro bono' in exchange for social media exposure.,Shared the significant cost of a smile makeover and had to politely inform the customer that we do not offer free services in exchange for social media marketing.,0
425,Asked about the cost of an emergency exam and said they would just look up their symptoms on the internet and try to diagnose it themselves.,"Informed the customer of the emergency exam fee, and they opted to use the internet for self-diagnosis rather than seeking a professional dental opinion.",0
426,"Was in a lot of pain and had a rope-like swelling along their jawline, and they were very worried it was a spreading dental infection.","Recognized the signs of a potential fascial space infection, a serious condition, and instructed the patient to come to the office for immediate evaluation.",1
427,"Called to schedule a new patient appointment, mentioning they had just completed cancer treatment and were now cleared to resume regular dental care.",Warmly congratulated the patient on completing their treatment and scheduled them for a gentle but thorough exam to help them maintain their oral health.,1
428,"Had a temporary crown fall off while they were flossing, and they were anxious to get it put back on before the tooth shifted or became sensitive.",Reassured the patient and scheduled them for a prompt appointment to re-cement the temporary crown and ensure the tooth's position and health were maintained.,1
429,"Asked to book a consultation to discuss orthodontics for themselves as an adult, as they had always been self-conscious about their crooked teeth.","Scheduled a comprehensive adult orthodontic consultation for the patient to explore their options, like braces or Invisalign, to achieve a straighter smile.",1
430,"Called to make an appointment for a check-up and cleaning, stating they were taking advantage of their company's annual 'wellness day' off from work.",Commended the patient for using their wellness day for their health and scheduled them for a convenient check-up and cleaning appointment.,1
431,Inquired about the cost of a sinus lift surgery needed for an implant and said the complexity and price were just too overwhelming for them.,"Explained the sinus lift procedure and the associated costs, but the customer expressed feeling overwhelmed by both the surgical nature and the high price.",0
432,Asked for the price of a routine exam and then said they would only book if they could get a written guarantee that the appointment would be painless.,"Reassured the customer that we prioritize comfort but explained that we cannot provide a written guarantee of a completely painless experience, which made them decline.",0
433,Called to get a quote for a root canal and asked if the price would be cheaper if they skipped the rubber dam that the dentist uses to isolate the tooth.,"Gave the customer the quote and had to explain that the rubber dam was a mandatory standard of care for safety and success, not an optional, cost-saving item.",0
434,Requested the price of a custom-made snore guard and decided they would just buy a cheap one from an infomercial they saw on TV.,"Shared the price for a custom-fitted oral appliance, and the customer opted to try a much cheaper, 'as seen on TV' generic snore guard instead.",0
