lead_id,customer_summary,agent_summary,conversion_label
1223,Called to get a price for a new set of dentures and said the cost was too high for their fixed pension income.,"Provided the fee for the dentures, and the customer expressed that the expense was not manageable on their fixed retirement income.",0
1224,Requested a quote for braces for their daughter and said they would need to look into payment plan options because the total cost was so high.,"Gave the customer the total cost for the braces and discussed our financing options, but they did not commit, citing the large overall expense.",0
1225,"Asked about the cost of a new filling and decided to wait, saying it wasn't hurting them yet.","Informed the customer of the fee for the filling, but they chose to delay the treatment because the tooth was not currently causing any pain.",0
1226,Was in a lot of pain from a broken tooth and was very happy to be scheduled for a same-day emergency visit.,Prioritized the patient's pain and scheduled them for an immediate emergency appointment to address their broken tooth.,1
1227,Called to schedule their regular three-month periodontal cleaning.,Booked the patient for their routine periodontal maintenance visit as per their prescribed schedule.,1
1228,"Had a temporary crown come loose and was worried it would fall off, so they booked an appointment to get it re-cemented.",Recognized the patient's concern and scheduled them for a quick appointment to have their temporary crown secured.,1
1229,Called to book an appointment to get a second opinion on a root canal that was recommended by another office.,"Scheduled the patient for a comprehensive second opinion, including an x-ray, to evaluate the tooth in question.",1
1230,Needed to make an appointment to have a cavity filled and was able to find a time that worked well for them.,Helped the patient schedule their filling appointment for a convenient time.,1
1231,Inquired about the price of a dental implant and said they would have to take out a loan from their bank to pay for it.,"Provided the cost for the implant, and the customer stated that they would need to seek external financing from a bank, and did not book.",0
1232,Asked for the cost of a dental cleaning and said they would have to pass for now due to some unexpected bills.,"Shared the fee for the cleaning, but the customer declined to schedule, explaining that other recent bills had taken priority.",0
1233,Called to get a quote for a new crown and said the price was more than they were comfortable spending.,"Provided the fee for the crown, and the customer clearly stated that the cost was beyond what they were willing to pay.",0
1234,Requested the price for a new partial denture and said they were going to have to think long and hard about that kind of expense.,"Gave the customer the quote for the partial, and they expressed that the significant cost required serious consideration before they could decide.",0
1235,Asked about the cost of a tooth extraction and then said they would wait until the tooth became more painful before doing anything.,"Informed the customer of the extraction fee, but they opted to postpone the procedure until the symptoms became more severe.",0
1236,Was experiencing a lot of sensitivity in one area of their mouth and booked an appointment to have the dentist diagnose the problem.,Scheduled a diagnostic exam for the patient to investigate the source of their localized dental sensitivity.,1
1237,Called to schedule a new patient exam and cleaning for themself and their husband.,Found back-to-back appointments and scheduled the patient and their husband for their new patient visits.,1
1238,"Had a wire on their permanent retainer break and it was scratching their tongue, so they booked an appointment to have it smoothed.",Understood the patient's discomfort and scheduled them for a prompt appointment to have the sharp retainer wire smoothed down.,1
1239,"Called to book a consultation to see if their son needed braces, as his adult teeth were coming in crowded.",Scheduled the child for an orthodontic evaluation to assess the crowding and discuss potential treatment options.,1
1240,Needed to get a dental form filled out for their child's school and scheduled a check-up to have it completed.,Booked the child for their check-up and made a note to complete the required school dental form during the visit.,1
1241,Inquired about the price of a full set of cosmetic veneers and said it was a 'dream' but not a reality for them at that price.,"Provided the total cost for the veneers, and the customer responded that the high price made the treatment an unattainable goal for them.",0
1242,Asked for the cost of a new filling and then said they would have to check their flexible spending account balance first.,"Gave the customer the fee for the filling, but they needed to verify the balance in their FSA before they could schedule the appointment.",0
1243,Called to get a price for a replacement night guard and complained that the cost seemed very high for a piece of plastic.,"Informed the customer of the fee for the custom medical appliance, but they expressed dissatisfaction, comparing it to a simple piece of plastic.",0
1244,Requested a quote for a dental bridge and said they needed to discuss the financial commitment with their partner.,"Shared the price for the bridge, and the customer indicated that a joint decision with their partner was necessary before proceeding.",0
1245,Asked about the cost of a deep cleaning and said they would just try to use a special mouthwash and hope that it helps.,"Provided the fee for the periodontal therapy, but the customer opted to try a less effective, over-the-counter product instead of professional treatment.",0
1246,Was in a lot of pain and was very relieved that we offered emergency dental services on a Saturday.,Recognized the patient's urgent need and scheduled them for an emergency appointment during our weekend hours.,1
1247,Called to schedule their regular six-month cleaning and exam.,Assisted the patient in booking their routine hygiene appointment for a convenient time.,1
1248,"Had a crown on a front tooth chip and was anxious to have it repaired, so they booked the first available appointment.",Understood the cosmetic concern and scheduled the patient for a priority appointment to have their chipped crown repaired.,1
1249,Called to make an appointment to have a tooth looked at that had been sensitive to sweets for a while.,Listened to the patient's symptom and scheduled them for an exam and x-ray to check for decay.,1
1250,"Needed to have their dentures adjusted as they were causing a sore spot, and they were able to get an appointment for the next day.",Recognized the patient's discomfort and scheduled them for a prompt denture adjustment appointment.,1
1251,"Inquired about the price of a new dental crown and said the cost was too high, so they would have to risk the tooth breaking.","Provided the fee for the crown, but the customer declined the treatment, stating they would have to take their chances with the compromised tooth.",0
1252,Asked for the cost of a tooth extraction and said they would have to wait until their next disability check arrived.,"Gave the customer the price for the extraction, and they indicated they could not afford it until their next disability payment was received.",0
1253,Called to get a quote for a new partial denture and said they would have to cancel their cable TV to be able to afford the monthly payments.,"Discussed our financing options for the partial, and the customer commented that the monthly payment would require them to cut other expenses like cable.",0
1254,"Requested the price for a dental implant and said they would have to drain their savings account to pay for it, which they were hesitant to do.","Shared the total cost for the implant, and the customer expressed reluctance to deplete their savings account for the procedure.",0
1255,Asked about the cost of braces for their teenager and said they would have to get a second mortgage on their house to pay for them.,"Provided the total cost for the orthodontic treatment, and the parent responded, perhaps hyperbolically, that it would require a second mortgage.",0
1256,Was experiencing a lot of pain and pressure in their sinuses and was referred by their doctor to rule out a dental cause.,Understood the medical referral and scheduled the patient for a comprehensive exam and x-rays to check the upper teeth.,1
1257,Called to schedule a new patient appointment after their neighbor told them what a great experience they had at our office.,Welcomed the patient who was referred by their neighbor and scheduled them for their first comprehensive visit.,1
1258,Had a temporary filling fall out from a tooth that had a root canal and was anxious to get a permanent crown put on.,Recognized the need to protect the root-canaled tooth and scheduled the patient for their permanent crown preparation appointment.,1
1259,Called to book a consultation to discuss options for closing a gap between their two front teeth.,"Scheduled a cosmetic consultation for the patient to explore their options, such as bonding or orthodontics, to close their diastema.",1
1260,Needed to get a mouthguard for their son for football season and booked an appointment to have one custom-fitted.,Scheduled the son for an appointment to take an impression for a custom athletic mouthguard to protect his teeth during football.,1
1261,Inquired about the price of a full mouth debridement and seemed overwhelmed by the cost and the amount of cleaning needed.,"Explained the necessity and the fee for the debridement procedure, but the customer seemed very hesitant and did not book.",0
1262,Asked for the price of a dental cleaning and then said they would wait to see if a new patient discount was offered in the local paper.,"Informed the customer of our standard fee, and they indicated they would wait in hopes of finding a promotional coupon in the future.",0
1263,Called to get a price for a new dental bridge and said the cost was more than their monthly mortgage payment.,"Provided the quote for the bridge, and the customer responded by comparing the single dental expense to their monthly mortgage bill.",0
1264,Requested a quote for a new set of premium dentures and said the price was just not realistic for them.,"Shared the price for our high-end premium dentures, and the customer was clear that the cost was not realistic for their budget.",0
1265,Asked about the cost of a replacement filling and decided to just be careful chewing on that side to avoid breaking the tooth more.,"Gave the customer the fee for the filling, but they opted to try and manage the problem by altering their chewing habits instead of getting the repair.",0
1266,"Was in a lot of pain after a recent extraction and was worried it might be a dry socket, so they came in to have it checked.",Recognized the post-operative symptoms and scheduled an immediate follow-up visit to evaluate the extraction site for a dry socket.,1
1267,Called to schedule their regular six-month cleaning and exam and was able to get an appointment at their preferred time.,Assisted the patient in booking their routine hygiene visit for the exact day and time they requested.,1
1268,"Had a temporary crown on a front tooth break and was very embarrassed, so they were relieved to get a same-day appointment.",Understood the cosmetic emergency and fit the patient in for a same-day visit to fabricate a new temporary crown.,1
1269,Called to make an appointment to discuss getting a dental implant to replace a failing bridge.,Scheduled a comprehensive consultation for the patient to discuss removing their old bridge and replacing it with dental implants.,1
1270,Needed to have a couple of cavities filled and was able to find an appointment time that fit into their lunch break from work.,Helped the patient find a convenient lunchtime appointment to have their fillings completed.,1
1271,Asked about the cost of an orthodontic treatment and said they would have to talk to their parents about getting help with the payments.,"Provided the total cost for the braces, and the young adult patient stated that they would need to seek financial assistance from their parents.",0
1272,Inquired about the price of a new crown and complained that the price seemed to go up every year.,"Informed the customer of our current fee for a crown, and they responded by complaining about the perceived annual price increases.",0
1273,Called to get a quote for a root canal and said they would have to put the entire amount on their CareCredit card.,"Provided the fee for the root canal and discussed the third-party financing option, but the customer did not book, needing to consider the debt.",0
1274,Requested the price for a new partial denture and said they would have to wait until they received their inheritance.,"Shared the price for the partial denture, and the customer stated that their ability to pay for the treatment was contingent on receiving an inheritance.",0
1275,Asked about the cost of a deep cleaning and said they would have to cancel their family's streaming services to afford it.,"Provided the cost for the periodontal therapy, and the customer remarked that the expense would require them to cut back on monthly household bills.",0
1276,"Was experiencing a lot of pain and a bad smell from a tooth and was worried it was abscessed, so they booked an urgent visit.",Recognized the classic signs of an abscess and scheduled the patient for an urgent appointment for diagnosis and treatment.,1
1277,Called to schedule a new patient appointment for their daughter who was starting college in the area.,Welcomed the new student and scheduled her for her first comprehensive exam and cleaning at our office.,1
1278,"Had a filling fall out and the tooth was very sensitive, so they were happy to get an appointment for the very next day.",Recognized the patient's sensitivity and scheduled them for a prompt appointment to have the tooth refilled.,1
1279,"Called to book a consultation to have their teeth whitened, as they had recently quit smoking and wanted to get rid of the stains.","Congratulated the patient on quitting smoking and scheduled a whitening consultation to help them achieve a brighter, healthier-looking smile.",1
1280,Needed to schedule a follow-up appointment to check on the healing of a gum graft surgery.,Booked the patient for their post-operative follow-up appointment to have their gum graft checked by the dentist.,1
1281,Inquired about the price of a dental implant and said the cost was 'out of this world' and they could never afford it.,"Provided the total cost for the implant, and the customer responded with an emphatic statement that the price was completely unaffordable for them.",0
1282,Asked for the cost of a check-up and cleaning and then said they would call back after they checked their bank account balance.,"Gave the customer the fees for the visit, and they indicated they needed to verify their available funds before they could schedule.",0
1283,Called to get a quote for a new dental bridge and said they were going to look into dental tourism options in Mexico.,"Provided our fee for the bridge, and the customer explicitly mentioned they were exploring traveling to Mexico for a lower-cost alternative.",0
1284,Requested a price for a new crown and said they would have to dip into the money they had saved for a family vacation.,"Informed the customer of the crown fee, and they expressed that the unexpected dental cost would have to come out of their family's vacation fund.",0
1285,"Asked about the cost of a filling and decided to wait, hoping the cavity wouldn't get any deeper.","Provided the fee for the filling, but the customer chose to postpone the necessary treatment and hope the condition did not worsen.",0
1286,"Woke up with a locked jaw and was in a lot of pain, so they booked an immediate emergency appointment for their TMJ.",Recognized the urgency of the acute TMJ lock and scheduled the patient for an immediate visit to address their pain and limited opening.,1
1287,Called to schedule their regular six-month cleaning and exam.,Assisted the patient in booking their routine hygiene appointment for a convenient time.,1
1288,"Had a temporary crown fall off and was concerned about the tooth underneath, so they scheduled an appointment to have it re-cemented.",Understood the patient's concern and booked them a prompt appointment to have their temporary crown put back on.,1
1289,"Called to make an appointment to discuss replacing their old, worn-out dentures with a new set.","Scheduled a consultation for the patient to discuss options and get an estimate for a new, better-fitting set of dentures.",1
1290,Needed to schedule their child's routine dental check-up and was able to find a time that worked well during the summer break.,Helped the parent find a convenient appointment time during the summer holiday for their child's annual check-up.,1
1291,Asked about the cost of a full set of cosmetic veneers and said the price was more than a year's worth of their rent.,"Provided the quote for the veneers, and the customer responded by comparing the total dental fee to the cost of their housing for an entire year.",0
1292,Inquired about the price of an extraction and said they would have to use their rent money to pay for it and would be late on their rent.,"Gave the customer the fee for the extraction, and they expressed that paying for the urgent dental care would cause them to be late on their rent payment.",0
1293,"Called to get a quote for a new partial denture and said the price was too steep, so they would have to go without.","Provided the price for the partial denture, but the customer concluded that the cost was too high and they would have to live with the missing teeth.",0
1294,Requested the price for a new night guard and said they would just continue to let their teeth get worn down because they couldn't afford it.,"Informed the customer of the fee for the protective night guard, but they resignedly stated they would have to let the damage from grinding continue.",0
1295,Asked about the cost of a deep cleaning and said they would just have to hope their gums didn't get any worse because the treatment was too expensive.,"Shared the fee for the necessary periodontal therapy, but the customer chose to decline treatment due to cost, despite the risk of disease progression.",0
1296,Was experiencing a lot of pain and a bad taste from a tooth and was relieved to schedule an urgent appointment.,Recognized the signs of an infection and scheduled the patient for an urgent visit to be diagnosed and treated.,1
1297,Called to schedule a new patient appointment after being referred by their primary care physician due to a related health condition.,Understood the medical referral and scheduled the new patient for a comprehensive dental evaluation.,1
1298,"Had a piece of a molar break off and it was sharp, so they booked an appointment to have it smoothed and restored.",Recognized the patient's discomfort from the sharp tooth fragment and scheduled a prompt appointment for a repair.,1
1299,"Called to book a consultation to finally replace a missing front tooth with a dental implant, stating they had saved up the money for it.",Congratulated the patient on being ready to proceed and scheduled them for their dental implant consultation.,1
1300,Needed to have a cavity filled and was able to find an appointment that fit perfectly into their work schedule.,Assisted the patient in finding a convenient time to come in for their filling appointment.,1
1301,"Inquired about the cost of a dental implant, but also asked for the specific titanium alloy grade and manufacturer. Seemed to disbelieve the price when they couldn't get that info.","Provided the total cost for the implant procedure. When unable to provide detailed metallurgical specifications on the spot, the customer became skeptical and ended the call.",0
1302,"Asked for the price of a root canal, then questioned if the procedure was even necessary, suggesting dentists over-prescribe them. Decided to 'wait and see.'",Explained the clinical signs indicating the need for a root canal and provided the fee. The customer expressed distrust in the diagnosis and chose not to schedule the treatment.,0
1303,"Called to get a quote for a new crown, then asked if we provide a written lifetime guarantee against it ever chipping or breaking. Declined to book when told that wasn't possible.","Gave the customer the price for a new crown and explained our lab warranty policy. The customer was insistent on a lifetime guarantee, which we could not provide.",0
1304,Requested the price of a smile makeover and then asked if the dentist would be willing to accept a classic watch as partial payment.,Shared the estimated cost for the smile makeover and had to politely explain that our office cannot accept goods or bartered items as payment for services.,0
1305,"Asked about the cost of a cleaning, then stated they follow a 'holistic' protocol and would only book if we promised not to use fluoride.","Informed the customer of the cleaning fee and their right to refuse fluoride. However, their subsequent questions about the 'toxicity' of our instruments led to them not booking.",0
1306,Was experiencing severe pain from a broken molar. Asked detailed questions about the materials in a crown and the likely prognosis before booking an emergency visit.,"Addressed the patient's concerns about crown materials and the long-term outlook for the tooth, then scheduled them for an immediate emergency appointment to address the pain.",1
1307,Called to schedule a new patient appointment. Mentioned they have extreme dental phobia and asked for a step-by-step explanation of what would happen before agreeing to come in.,"Patiently walked the potential new patient through the entire new patient visit process, from check-in to exam, which reassured them enough to book the appointment.",1
1308,"Had a dental bridge come loose. Asked if it was possible to just 'superglue' it back in. After being advised against this, they scheduled an appointment to have it re-cemented properly.",Strongly advised the patient against using household adhesives in their mouth. The patient understood the risks and scheduled a priority appointment for a professional repair.,1
1309,"Called to book a consultation to discuss replacing their old amalgam fillings, asking about our safety protocols for removal before scheduling.","Explained our safety procedures for amalgam removal, including the use of high-speed suction and rubber dams, which satisfied the patient's concerns and led them to book.",1
1310,Needed to schedule a cleaning for their child with special needs. Asked specific questions about how the hygienist handles sensory issues before booking.,"Reassured the parent by detailing our approach to treating patients with sensory sensitivities, including using quiet rooms and explaining every step, which led them to schedule.",1
1311,"Inquired about the cost of a tooth extraction, then asked if the dentist could just write them a prescription for strong painkillers instead of doing the procedure.",Informed the customer of the extraction fee and explained the clinical policy against prescribing opioids without an examination and definitive treatment plan. The customer declined the visit.,0
1312,"Asked for the price of a cleaning, but wanted to know if they could bring their own 'herbal' polishing paste for the hygienist to use.","Explained that for safety and clinical standards, we can only use professionally approved materials. The customer was not satisfied with this and did not book.",0
1313,"Called to get a quote for a new partial denture and asked if they could pay for it in very small, weekly cash installments without a formal payment plan.","Provided the quote for the partial and explained our third-party financing options. We were unable to accommodate their request for an informal, micro-payment schedule.",0
1314,"Requested the price of a dental bonding, then asked if the dentist could do it at their home, as they were a 'private person'.",Shared the price for the bonding and had to explain that all dental procedures must be performed in a clinical environment for safety and sterility reasons.,0
1315,"Asked about the cost of a new crown, then wanted to know if we could bill their insurance for a different, more expensive procedure so they would get more money back.",Informed the customer of the correct fee and procedure code and had to firmly decline their request to commit insurance fraud.,0
1316,"Was having a severe allergic reaction in their mouth to something they ate. They asked if the dentist could identify the allergen before they came in. Explained we could diagnose the reaction but not the specific allergen, and they booked an urgent visit.","Clarified our diagnostic capabilities, explaining we could treat the oral symptoms but not perform allergy testing. The patient understood and scheduled an immediate appointment for relief.",1
1317,"Called to book an appointment to have a chipped tooth fixed, admitting they had been putting it off for years due to a bad experience with a previous dentist.","Listened with empathy to the patient's concerns stemming from their past experience and reassured them of our gentle approach, which convinced them to book the repair.",1
1318,Had a new crown that was causing food to get stuck. They asked if it was normal. We explained it was not and scheduled a no-charge follow-up to adjust the contact.,"Reassured the patient that the food trap was not normal and should be fixed. Scheduled a prompt, complimentary follow-up appointment to adjust the crown.",1
